settings.lengow_main_settings.label|Main settings
settings.lengow_main_settings.description|Below you will find your Lengow login details.<br />Account ID, Access Token and Secret Token are automatically completed at your first connection : please do not change them.
settings.lengow_main_settings.account.label|Account ID
settings.lengow_main_settings.account.description|Your Lengow account ID. Please do not change it.
settings.lengow_main_settings.access.label|Access Token
settings.lengow_main_settings.access.description|Your access token. Please do not change it.
settings.lengow_main_settings.secret.label|Secret Token
settings.lengow_main_settings.secret.description|Your secret token. Please do not change it.
settings.lengow_main_settings.enable.label|Enable shop
settings.lengow_main_settings.enable.description|Enable shop to work with Lengow
settings.lengow_main_settings.catalog.label|Catalogues ID
settings.lengow_main_settings.catalog.description|Your catalogues ID to import orders.<br />Separate them by ' ; '
settings.lengow_main_settings.ip_enable.label|Enable authorisation by IP
settings.lengow_main_settings.ip_enable.description|Enable this option if you want your export to be secured by IP. By default, your export is secured by a unique key.
settings.lengow_main_settings.ip.label|Authorised IPs
settings.lengow_main_settings.ip.description|Authorise IP to get access to your export feed.<br />Separate them ' ; '
settings.lengow_main_settings.tracking_enable.label|Enable Lengow tracking
settings.lengow_main_settings.tracking_enable.description|This tracker allows you to retrieve order statistics generated on your site directly in Lengow.
settings.lengow_main_settings.tracking_id.label|Tracker Product ID
settings.lengow_main_settings.tracking_id.description|The name of the unique identifier entered in the Lengow
settings.lengow_export_settings.label|Export settings
settings.lengow_export_settings.description|Define the settings to create your feed.
settings.lengow_export_settings.disabled_products.label|Export inactive products
settings.lengow_export_settings.disabled_products.description|Enable this option if you want to export inactive products
settings.lengow_export_settings.lengow_selection.label|Export specific products only
settings.lengow_export_settings.lengow_selection.description|Activate this option if you do not want to export all of your avaible products. Then select your products one by one.
settings.lengow_export_settings.dispatcher.label|Default carrier
settings.lengow_export_settings.dispatcher.description|Select the default carrier to calculate shipping costs
settings.lengow_import_settings.label|Import settings
settings.lengow_import_settings.description|All your orders are centralized in your Lengow platform : choose here if you want to synchronize and import your orders in your Shopware backoffice. It will also decrease your products stock in your backoffice
settings.lengow_import_settings.ship_mp_enabled.label|Import orders shipped by marketplaces
settings.lengow_import_settings.decrease_stock.label|Decrease my stock with the orders shipped by marketplaces
settings.lengow_import_settings.decrease_stock.description|Use this option to take into account your orders sent by marketplaces on your stock in your Shopware backoffice
settings.lengow_import_settings.dispatcher.label|Default carrier
settings.lengow_import_settings.dispatcher.description|Select the default carrier that you would like to apply to your orders
settings.lengow_import_settings.import_days.label|Synchronize all orders updated since
settings.lengow_import_settings.import_days.description|Choose a number of days (Max 10 days)
settings.lengow_import_settings.debug_mode.label|Activate Debug Mode
settings.lengow_import_settings.debug_mode.description|Use Debug Mode for testing and to simulate fictitious orders. Please note that you have to activate this setting on your pre-production server ONLY
settings.lengow_import_settings.report_mail_enabled.label|I would like to be notified when there are issues regarding order importation
settings.lengow_import_settings.report_mail_address.label|Mail for the report email
settings.lengow_import_settings.report_mail_address.description|Email separated by ;
settings.lengow_import_settings.currency_conversion_title.label|Convert the currency of your order
settings.lengow_import_settings.currency_conversion_title.description|All orders imported into Shopware will be automatically converted into the currency you've selected in Lengow
settings.lengow_import_settings.import_btob.label|Enable import of B2B orders without tax
settings.lengow_import_settings.import_btob.description|Activate this option to import B2B orders without tax
settings.lengow_order_status_settings.label|Order Status
settings.lengow_order_status_settings.description|Match your Lengow order status to retrieve them in your orders easily
settings.lengow_order_status_settings.id_waiting_shipment.label|Orders in preparation
settings.lengow_order_status_settings.id_shipped.label|Shipped orders
settings.lengow_order_status_settings.id_canceled.label|Cancelled orders
settings.lengow_order_status_settings.id_shipped_by_mp.label|Orders shipped by marketplace
lengow_log.error.nb_order_imported|%{nb_order} order(s) imported
lengow_log.error.nb_order_updated|%{nb_order} order(s) updated
lengow_log.error.nb_order_with_error|%{nb_order} order(s) with errors
lengow_log.error.rest_time_to_import|Please wait %{rest_time} seconds before syncing your orders again
lengow_log.error.credentials_not_valid|Account ID, token access or secret token are not valid
lengow_log.error.no_catalog_for_sales_channel|No catalog ID valid for the sales channel %{sales_channel_name} (%{sales_channel_id})
lengow_log.error.order_not_found|Lengow error: order cannot be found in Lengow feed
lengow_log.error.no_product|Lengow error: no product in the order
lengow_log.error.no_change_rate|Lengow error: no exchange rates available for order prices
lengow_log.error.no_currency|Lengow error: no currency in the order
lengow_log.error.currency_not_available|the %{currency_iso} currency is not available in your shop
lengow_log.error.no_billing_address|Lengow error: no billing address in the order
lengow_log.error.no_country_for_billing_address|Lengow error: billing address doesn't contain the country
lengow_log.error.no_country_for_delivery_address|Lengow error: delivery address doesn't contain the country
lengow_log.exception.no_connection_webservice|connection did not work with the Lengow webservice in sales channel %{sales_channel_name} (%{sales_channel_id})
lengow_log.exception.error_lengow_webservice|Lengow webservice: %{error_code} - "%{error_message}" in sales channel %{sales_channel_name} (%{sales_channel_id})
lengow_log.exception.marketplace_not_present|Lengow error: %{marketplace_name} does not feature in the marketplace list
lengow_log.exception.no_product_to_cart|no product to be added to cart
lengow_log.exception.product_is_a_parent|product %{product_number} (%{product_id}) is a parent. Product variation is needed
lengow_log.exception.no_quantity_for_product|product %{product_number} (%{product_id}) could not be added to cart. Make sure it is available to order or that there is enough in stock
lengow_log.exception.product_not_be_found|product %{product_id} could not be found
lengow_log.exception.country_not_found|No country found for ISO code %{iso_code}. Please add it into your Shopware configuration
lengow_log.exception.salutation_not_found|No salutation found in our system. Please add it into your Shopware configuration
lengow_log.exception.shopware_customer_not_saved|WARNING! Customer could NOT be saved in Shopware user table
lengow_log.exception.shopware_order_not_saved|WARNING! Order could NOT be saved in Shopware order table
log.export.unauthorised_ip|Unauthorized access for IP: %{ip}
log.export.unauthorised_token|Unauthorised access for this token: %{token}
log.export.empty_token|Unauthorised access: token parameter is empty
log.export.specify_sales_channel|No sales channel specified or invalid sales channel uuid
log.import.debug_mode_active|WARNING! Debug Mode is activated
log.import.start|## start %{type} import ##
log.import.end|## end %{type} import ##
log.import.import_failed|import failed - %{decoded_message}
log.import.start_for_sales_channel|start import in sales channel %{sales_channel_name} (%{sales_channel_id})
log.import.catalog_id_already_used|catalog ID %{catalog_id} is already used by sales channel %{sales_channel_name} (%{sales_channel_id})
log.import.find_one_order|%{nb_order} order found for order ID: %{marketplace_sku} and marketplace: %{marketplace_name} with account ID: %{account_id}
log.import.find_all_orders|%{nb_order} order(s) found for sales channel %{sales_channel_name} (%{sales_channel_id})
log.import.connector_get_order|get order with order ID: %{marketplace_sku} and marketplace: %{marketplace_name}
log.import.connector_get_all_order|get orders between %{date_from} and %{date_to} for catalogs ID: %{catalog_id}
log.import.marketplace_update_failed|marketplace update failed - %{decoded_message}
log.import.error_no_package|import order failed - Lengow error: no package in the order
log.import.error_wrong_package_number|import order failed - wrong package number
log.import.error_no_delivery_address|import order failed - Lengow error: no delivery address in the order
log.import.error_already_created|%{decoded_message} (created on the %{date_message})
log.import.order_already_imported|order already imported (ORDER ID %{order_id})
log.import.order_ready_to_reimport|order ready to be re-imported (ORDER ID %{order_id})
log.import.order_state_updated|order's status has been updated to %{state_name}
log.import.order_import_failed|import order failed - %{decoded_message}
log.import.anonymized_order|order is anonymized and has not been imported
log.import.old_order|Order is older than 3 months and has not been imported
log.import.external_id_exist|already imported in Shopware with the order ID %{order_id}
log.import.current_order_state_unavailable|current order's status [%{order_state_marketplace}] makes it unavailable to import for marketplace %{marketplace_name}
log.import.lengow_order_saved|order saved in Lengow orders table
log.import.lengow_order_not_saved|WARNING! Order could NOT be saved in Lengow orders table
log.import.lengow_order_updated|order updated in Lengow orders table
log.import.lengow_order_line_saved|save order lines product: %{order_line_saved}
log.import.rewrite_processing_fee|rewrite amount without processing fee
log.import.rewrite_shipping_cost|rewrite amount without shipping cost
log.import.order_shipped_by_marketplace|order shipped by %{marketplace_name}
log.import.product_state_canceled|product %{product_id} could not be added - status: %{product_state}
log.import.product_advanced_search|product not found with field %{attribute_name} (%{attribute_value}). Using advanced search
log.import.product_be_found|product %{product_number} (%{product_id}) found with field %{attribute_name} (%{attribute_value}) and attribute %{search_field}
log.import.generate_unique_email|generate a unique email %{email}
log.import.lengow_payment_not_found|WARNING! Unable to retrieve Lengow payment method
log.import.stock_decreased|stock updated for product %{product_number} from %{initial_stock} to %{new_stock}
log.import.quantity_back_shipped_by_marketplace|adding quantity back to stock (order shipped by marketplace)
log.import.quantity_back_reimported_order|adding quantity back to stock (order is re-imported)
log.import.order_successfully_imported|order successfully imported (ORDER ID %{order_number})
log.import.order_synchronized_with_lengow|order successfully synchronised with Lengow webservice (ORDER ID %{order_id})
log.import.order_not_synchronized_with_lengow|WARNING! Order could NOT be synchronised with Lengow webservice (ORDER ID %{order_id})
log.connector.call_api|call %{call_type} %{curl_url}
log.connector.error_api|API call failed - %{error_code} - %{error_message}
log.connector.curl_disabled|Curl extension is not enabled on the server
log.connector.method_not_valid|method %{type} is not valid
log.connector.timeout_api|API call has been blocked by a timeout
log.connector.error_curl|Curl error %{error_code} - %{error_message}
log.connector.token_not_return|no authorization token returned
log.connector.token_is_empty|the returned authorization token is empty
log.connector.api_not_available|Lengow APIs are not available
log.connector.retry_get_token|API call failed - authorization token expired - attempt to recover a new token
log.orm.field_is_required|Error while creating record in database: %{field} is required
log.orm.record_insert_failed|Error while inserting record in database: %{decoded_message}
log.setting.setting_change|%{key} - old value %{old_value} replaced with %{value}
log.setting.setting_change_for_sales_channel|%{key} - old value %{old_value} replaced with %{value} for sales channel %{sales_channel_id}
